{
  "name": "Example Brand",
  "brandAnchor": { "l": 0.6, "c": 0.15, "h": 250, "alpha": 1 },
  "neutralHue": 250,
  "neutralChroma": 0.012,
  "typography": { "fontFamily": "Inter, system-ui, sans-serif", "baseSizePx": 16, "ratio": 1.25 },
  "spacingBasePx": 4,
  "density": "comfortable",
  "radius": { "sm": 4, "md": 8, "lg": 16, "full": 9999 },
  "targets": { "minWcagRatio": 4.5 }
}
